{
  "schema_version": 1,
  "compiled_system": {
    "id": "system:example",
    "name": "Independent BEAT example",
    "contract_version": 1,
    "meshes": [
      {
        "id": "mesh:exterior",
        "name": "Exterior",
        "file": "exterior.msh",
        "purpose": "bem_surface",
        "scale_to_m": 0.001,
        "translation_m": [
          0,
          0,
          0
        ]
      }
    ],
    "regions": [
      {
        "id": "region:exterior",
        "name": "Exterior",
        "kind": "unbounded_air",
        "mesh_ids": [
          "mesh:exterior"
        ],
        "volume_groups": [],
        "sound_speed_m_per_s": 343.0,
        "density_kg_per_m3": 1.21,
        "loss_model": {}
      }
    ],
    "boundaries": [
      {
        "id": "boundary:source",
        "name": "Source",
        "kind": "moving",
        "region_id": "region:exterior",
        "group": {
          "mesh_id": "mesh:exterior",
          "dimension": 2,
          "tag": 2,
          "name": null
        },
        "parameters": {}
      }
    ],
    "interfaces": [],
    "components": [
      {
        "id": "component:source",
        "name": "Source",
        "kind": "ideal_velocity_source",
        "boundary_ids": [
          "boundary:source"
        ],
        "parameters": {}
      }
    ],
    "excitation_ports": [
      {
        "id": "excitation:source",
        "name": "Source",
        "component_id": "component:source",
        "kind": "normal_velocity"
      }
    ]
  },
  "frequencies_hz": [
    500,
    250
  ],
  "excitation_port_ids": [
    "excitation:source"
  ],
  "outputs": [
    {
      "id": "pressure",
      "quantity": "exterior_pressure",
      "target_ids": [],
      "options": {
        "points_m": [
          [
            0,
            0,
            2
          ]
        ]
      }
    }
  ],
  "solver_options": {
    "precision": "float32",
    "bem_backend": "cpu"
  }
}
